{
  "pack": "graph.89",
  "from": 8,
  "to": 9,
  "ops": [
    {
      "op": "ADD_ASSOCIATION",
      "association": {
        "concept_a": "c_0449",
        "concept_b": "c_0811",
        "relation_type": "luoghi",
        "direction_hint": "symmetric",
        "association_strength": 0.5,
        "confidence": 0.85,
        "status": "candidate",
        "revision": 1
      }
    },
    {
      "op": "ADD_ASSOCIATION",
      "association": {
        "concept_a": "c_0341",
        "concept_b": "c_0451",
        "relation_type": "luoghi",
        "direction_hint": "symmetric",
        "association_strength": 0.45,
        "confidence": 0.85,
        "status": "candidate",
        "revision": 1
      }
    },
    {
      "op": "ADD_ASSOCIATION",
      "association": {
        "concept_a": "c_0341",
        "concept_b": "c_0453",
        "relation_type": "luoghi",
        "direction_hint": "symmetric",
        "association_strength": 0.4,
        "confidence": 0.85,
        "status": "candidate",
        "revision": 1
      }
    },
    {
      "op": "ADD_ASSOCIATION",
      "association": {
        "concept_a": "c_0341",
        "concept_b": "c_0457",
        "relation_type": "luoghi",
        "direction_hint": "symmetric",
        "association_strength": 0.4,
        "confidence": 0.85,
        "status": "candidate",
        "revision": 1
      }
    },
    {
      "op": "ADD_ASSOCIATION",
      "association": {
        "concept_a": "c_0341",
        "concept_b": "c_0458",
        "relation_type": "luoghi",
        "direction_hint": "symmetric",
        "association_strength": 0.5,
        "confidence": 0.85,
        "status": "candidate",
        "revision": 1
      }
    },
    {
      "op": "ADD_ASSOCIATION",
      "association": {
        "concept_a": "c_0341",
        "concept_b": "c_0460",
        "relation_type": "luoghi",
        "direction_hint": "symmetric",
        "association_strength": 0.5,
        "confidence": 0.85,
        "status": "candidate",
        "revision": 1
      }
    },
    {
      "op": "ADD_ASSOCIATION",
      "association": {
        "concept_a": "c_0341",
        "concept_b": "c_0465",
        "relation_type": "luoghi",
        "direction_hint": "symmetric",
        "association_strength": 0.5,
        "confidence": 0.85,
        "status": "candidate",
        "revision": 1
      }
    }
  ]
}
