{
  "pack": "graph.a7",
  "from": 7,
  "to": 8,
  "ops": [
    {
      "op": "ADD_ASSOCIATION",
      "association": {
        "concept_a": "c_0372",
        "concept_b": "c_0567",
        "relation_type": "proprietà",
        "direction_hint": "symmetric",
        "association_strength": 0.45,
        "confidence": 0.85,
        "status": "candidate",
        "revision": 1
      }
    }
  ]
}
