{
  "pack": "graph.f0",
  "from": 18,
  "to": 19,
  "ops": [
    {
      "op": "ADD_ASSOCIATION",
      "association": {
        "concept_a": "c_0819",
        "concept_b": "c_0984",
        "relation_type": "proprietà",
        "direction_hint": "symmetric",
        "association_strength": 0.45,
        "confidence": 0.85,
        "status": "candidate",
        "revision": 1
      }
    },
    {
      "op": "ADD_ASSOCIATION",
      "association": {
        "concept_a": "c_0771",
        "concept_b": "c_0984",
        "relation_type": "evocativa",
        "direction_hint": "symmetric",
        "association_strength": 0.4,
        "confidence": 0.85,
        "status": "candidate",
        "revision": 1
      }
    },
    {
      "op": "ADD_ASSOCIATION",
      "association": {
        "concept_a": "c_0621",
        "concept_b": "c_1013",
        "relation_type": "evocativa",
        "direction_hint": "symmetric",
        "association_strength": 0.4,
        "confidence": 0.85,
        "status": "candidate",
        "revision": 1
      }
    },
    {
      "op": "ADD_ASSOCIATION",
      "association": {
        "concept_a": "c_0621",
        "concept_b": "c_0921",
        "relation_type": "luoghi",
        "direction_hint": "symmetric",
        "association_strength": 0.4,
        "confidence": 0.85,
        "status": "candidate",
        "revision": 1
      }
    }
  ]
}
