{
  "pack": "graph.2e",
  "from": 23,
  "to": 24,
  "ops": [
    {
      "op": "ADD_ASSOCIATION",
      "association": {
        "concept_a": "c_0882",
        "concept_b": "c_0887",
        "relation_type": "similarità",
        "direction_hint": "symmetric",
        "association_strength": 0.4,
        "confidence": 0.85,
        "status": "candidate",
        "revision": 1
      }
    },
    {
      "op": "ADD_ASSOCIATION",
      "association": {
        "concept_a": "c_0339",
        "concept_b": "c_0836",
        "relation_type": "categoria",
        "direction_hint": "symmetric",
        "association_strength": 0.5,
        "confidence": 0.85,
        "status": "candidate",
        "revision": 1
      }
    },
    {
      "op": "ADD_ASSOCIATION",
      "association": {
        "concept_a": "c_0339",
        "concept_b": "c_0836",
        "relation_type": "esseri_viventi",
        "direction_hint": "symmetric",
        "association_strength": 0.55,
        "confidence": 0.85,
        "status": "candidate",
        "revision": 1
      }
    },
    {
      "op": "ADD_ASSOCIATION",
      "association": {
        "concept_a": "c_0339",
        "concept_b": "c_0895",
        "relation_type": "esseri_viventi",
        "direction_hint": "symmetric",
        "association_strength": 0.4,
        "confidence": 0.85,
        "status": "candidate",
        "revision": 1
      }
    },
    {
      "op": "ADD_ASSOCIATION",
      "association": {
        "concept_a": "c_0339",
        "concept_b": "c_1027",
        "relation_type": "contenuto",
        "direction_hint": "symmetric",
        "association_strength": 0.5,
        "confidence": 0.85,
        "status": "candidate",
        "revision": 1
      }
    },
    {
      "op": "ADD_ASSOCIATION",
      "association": {
        "concept_a": "c_0339",
        "concept_b": "c_1027",
        "relation_type": "esseri_viventi",
        "direction_hint": "symmetric",
        "association_strength": 0.6,
        "confidence": 0.85,
        "status": "candidate",
        "revision": 1
      }
    },
    {
      "op": "ADD_ASSOCIATION",
      "association": {
        "concept_a": "c_0339",
        "concept_b": "c_0454",
        "relation_type": "esseri_viventi",
        "direction_hint": "symmetric",
        "association_strength": 0.5,
        "confidence": 0.85,
        "status": "candidate",
        "revision": 1
      }
    }
  ]
}
