{
  "pack": "graph.33",
  "from": 8,
  "to": 9,
  "ops": [
    {
      "op": "ADD_ASSOCIATION",
      "association": {
        "concept_a": "c_0114",
        "concept_b": "c_0116",
        "relation_type": "similarità",
        "direction_hint": "symmetric",
        "association_strength": 0.5,
        "confidence": 0.85,
        "status": "candidate",
        "revision": 1
      }
    }
  ]
}
