{
  "pack": "graph.d7",
  "from": 4,
  "to": 5,
  "ops": [
    {
      "op": "ADD_ASSOCIATION",
      "association": {
        "concept_a": "c_0163",
        "concept_b": "c_0627",
        "relation_type": "oggetti",
        "direction_hint": "symmetric",
        "association_strength": 0.4,
        "confidence": 0.85,
        "status": "candidate",
        "revision": 1
      }
    }
  ]
}
