{
  "pack": "graph.28",
  "from": 7,
  "to": 8,
  "ops": [
    {
      "op": "ADD_ASSOCIATION",
      "association": {
        "concept_a": "c_0168",
        "concept_b": "c_0841",
        "relation_type": "esseri_viventi",
        "direction_hint": "symmetric",
        "association_strength": 0.35,
        "confidence": 0.85,
        "status": "candidate",
        "revision": 1
      }
    }
  ]
}
