{
  "pack": "graph.d0",
  "from": 2,
  "to": 3,
  "ops": [
    {
      "op": "ADD_ASSOCIATION",
      "association": {
        "concept_a": "c_0168",
        "concept_b": "c_0342",
        "relation_type": "contenuto",
        "direction_hint": "symmetric",
        "association_strength": 0.6,
        "confidence": 0.85,
        "status": "candidate",
        "revision": 1
      }
    }
  ]
}
