{
  "pack": "graph.f8",
  "from": 1,
  "to": 2,
  "ops": [
    {
      "op": "UPDATE_CONCEPT",
      "concept_id": "c_0166",
      "concept": {
        "revision": 2,
        "region_id": null,
        "status_fronteira": "needs_expansion",
        "definition": {
          "text": "Locale o edificio dove si svolge un lavoro d'amministrazione; anche la carica che si ricopre.",
          "example": "Esce dall'ufficio verso le sei."
        }
      }
    },
    {
      "op": "UPDATE_CONCEPT",
      "concept_id": "c_0672",
      "concept": {
        "revision": 2,
        "region_id": null,
        "status_fronteira": "needs_expansion",
        "definition": {
          "text": "Il sottrarsi, anche solo con la mente, agli obblighi e alla routine.",
          "example": "Per lui il cinema è una forma di evasione."
        }
      }
    },
    {
      "op": "UPDATE_CONCEPT",
      "concept_id": "c_0698",
      "concept": {
        "revision": 2,
        "region_id": null,
        "status_fronteira": "needs_expansion",
        "definition": {
          "text": "Musica o parte strumentale che sostiene un canto o una scena.",
          "example": "Cantò la canzone con l'accompagnamento della chitarra."
        }
      }
    },
    {
      "op": "UPDATE_CONCEPT",
      "concept_id": "c_0737",
      "concept": {
        "revision": 2,
        "region_id": null,
        "status_fronteira": "needs_expansion",
        "definition": {
          "text": "L'ente che amministra un territorio e i suoi abitanti; il più piccolo dello Stato.",
          "example": "Il comune ha stanziato i fondi per la nuova scuola."
        }
      }
    }
  ]
}
