{
  "pack": "graph.80",
  "from": 11,
  "to": 12,
  "ops": [
    {
      "op": "ADD_ASSOCIATION",
      "association": {
        "concept_a": "c_0085",
        "concept_b": "c_0541",
        "relation_type": "effetti",
        "direction_hint": "symmetric",
        "association_strength": 0.4,
        "confidence": 0.85,
        "status": "candidate",
        "revision": 1
      }
    },
    {
      "op": "ADD_ASSOCIATION",
      "association": {
        "concept_a": "c_0171",
        "concept_b": "c_0546",
        "relation_type": "luoghi",
        "direction_hint": "symmetric",
        "association_strength": 0.5,
        "confidence": 0.85,
        "status": "candidate",
        "revision": 1
      }
    },
    {
      "op": "ADD_ASSOCIATION",
      "association": {
        "concept_a": "c_0085",
        "concept_b": "c_0548",
        "relation_type": "azioni",
        "direction_hint": "symmetric",
        "association_strength": 0.35,
        "confidence": 0.85,
        "status": "candidate",
        "revision": 1
      }
    },
    {
      "op": "ADD_ASSOCIATION",
      "association": {
        "concept_a": "c_0085",
        "concept_b": "c_0550",
        "relation_type": "evocativa",
        "direction_hint": "symmetric",
        "association_strength": 0.4,
        "confidence": 0.85,
        "status": "candidate",
        "revision": 1
      }
    }
  ]
}
