{
  "pack": "graph.4b",
  "from": 3,
  "to": 4,
  "ops": [
    {
      "op": "ADD_ASSOCIATION",
      "association": {
        "concept_a": "c_0125",
        "concept_b": "c_0530",
        "relation_type": "fenomeni",
        "direction_hint": "symmetric",
        "association_strength": 0.5,
        "confidence": 0.85,
        "status": "candidate",
        "revision": 1
      }
    },
    {
      "op": "ADD_ASSOCIATION",
      "association": {
        "concept_a": "c_0143",
        "concept_b": "c_0329",
        "relation_type": "categoria",
        "direction_hint": "symmetric",
        "association_strength": 0.7,
        "confidence": 0.85,
        "status": "candidate",
        "revision": 1
      }
    }
  ]
}
