{
  "pack": "graph.6e",
  "from": 29,
  "to": 30,
  "ops": [
    {
      "op": "ADD_ASSOCIATION",
      "association": {
        "concept_a": "c_0689",
        "concept_b": "c_1023",
        "relation_type": "azioni",
        "direction_hint": "symmetric",
        "association_strength": 0.35,
        "confidence": 0.85,
        "status": "candidate",
        "revision": 1
      }
    }
  ]
}
