{
  "pack": "graph.98",
  "from": 20,
  "to": 21,
  "ops": [
    {
      "op": "ADD_ASSOCIATION",
      "association": {
        "concept_a": "c_0603",
        "concept_b": "c_0889",
        "relation_type": "proprietà",
        "direction_hint": "symmetric",
        "association_strength": 0.4,
        "confidence": 0.85,
        "status": "candidate",
        "revision": 1
      }
    },
    {
      "op": "ADD_ASSOCIATION",
      "association": {
        "concept_a": "c_0603",
        "concept_b": "c_0889",
        "relation_type": "effetti",
        "direction_hint": "symmetric",
        "association_strength": 0.4,
        "confidence": 0.85,
        "status": "candidate",
        "revision": 1
      }
    }
  ]
}
