{
  "pack": "graph.b9",
  "from": 12,
  "to": 13,
  "ops": [
    {
      "op": "ADD_ASSOCIATION",
      "association": {
        "concept_a": "c_0583",
        "concept_b": "c_0608",
        "relation_type": "azioni",
        "direction_hint": "symmetric",
        "association_strength": 0.5,
        "confidence": 0.85,
        "status": "candidate",
        "revision": 1
      }
    },
    {
      "op": "ADD_ASSOCIATION",
      "association": {
        "concept_a": "c_0594",
        "concept_b": "c_0608",
        "relation_type": "azioni",
        "direction_hint": "symmetric",
        "association_strength": 0.4,
        "confidence": 0.85,
        "status": "candidate",
        "revision": 1
      }
    },
    {
      "op": "ADD_ASSOCIATION",
      "association": {
        "concept_a": "c_0597",
        "concept_b": "c_0608",
        "relation_type": "azioni",
        "direction_hint": "symmetric",
        "association_strength": 0.35,
        "confidence": 0.85,
        "status": "candidate",
        "revision": 1
      }
    },
    {
      "op": "ADD_ASSOCIATION",
      "association": {
        "concept_a": "c_0600",
        "concept_b": "c_0608",
        "relation_type": "azioni",
        "direction_hint": "symmetric",
        "association_strength": 0.4,
        "confidence": 0.85,
        "status": "candidate",
        "revision": 1
      }
    }
  ]
}
