{
  "pack": "graph.66",
  "from": 21,
  "to": 22,
  "ops": [
    {
      "op": "ADD_ASSOCIATION",
      "association": {
        "concept_a": "c_0656",
        "concept_b": "c_0782",
        "relation_type": "contenuto",
        "direction_hint": "symmetric",
        "association_strength": 0.4,
        "confidence": 0.85,
        "status": "candidate",
        "revision": 1
      }
    },
    {
      "op": "ADD_ASSOCIATION",
      "association": {
        "concept_a": "c_0656",
        "concept_b": "c_0782",
        "relation_type": "effetti",
        "direction_hint": "symmetric",
        "association_strength": 0.45,
        "confidence": 0.85,
        "status": "candidate",
        "revision": 1
      }
    },
    {
      "op": "ADD_ASSOCIATION",
      "association": {
        "concept_a": "c_0656",
        "concept_b": "c_0782",
        "relation_type": "evocativa",
        "direction_hint": "symmetric",
        "association_strength": 0.4,
        "confidence": 0.85,
        "status": "candidate",
        "revision": 1
      }
    },
    {
      "op": "ADD_ASSOCIATION",
      "association": {
        "concept_a": "c_0995",
        "concept_b": "c_1037",
        "relation_type": "effetti",
        "direction_hint": "symmetric",
        "association_strength": 0.35,
        "confidence": 0.85,
        "status": "candidate",
        "revision": 1
      }
    }
  ]
}
