{
  "pack": "graph.7b",
  "from": 15,
  "to": 16,
  "ops": [
    {
      "op": "ADD_ASSOCIATION",
      "association": {
        "concept_a": "c_0004",
        "concept_b": "c_0806",
        "relation_type": "cause",
        "direction_hint": "symmetric",
        "association_strength": 0.4,
        "confidence": 0.85,
        "status": "candidate",
        "revision": 1
      }
    },
    {
      "op": "ADD_ASSOCIATION",
      "association": {
        "concept_a": "c_0004",
        "concept_b": "c_0809",
        "relation_type": "cause",
        "direction_hint": "symmetric",
        "association_strength": 0.45,
        "confidence": 0.85,
        "status": "candidate",
        "revision": 1
      }
    },
    {
      "op": "ADD_ASSOCIATION",
      "association": {
        "concept_a": "c_0488",
        "concept_b": "c_0902",
        "relation_type": "evocativa",
        "direction_hint": "symmetric",
        "association_strength": 0.6,
        "confidence": 0.85,
        "status": "candidate",
        "revision": 1
      }
    }
  ]
}
