{
  "pack": "graph.79",
  "from": 11,
  "to": 12,
  "ops": [
    {
      "op": "ADD_ASSOCIATION",
      "association": {
        "concept_a": "c_0845",
        "concept_b": "c_0855",
        "relation_type": "categoria",
        "direction_hint": "symmetric",
        "association_strength": 0.5,
        "confidence": 0.85,
        "status": "candidate",
        "revision": 1
      }
    }
  ]
}
