{
  "pack": "graph.2f",
  "from": 20,
  "to": 21,
  "ops": [
    {
      "op": "ADD_ASSOCIATION",
      "association": {
        "concept_a": "c_0226",
        "concept_b": "c_0765",
        "relation_type": "categoria",
        "direction_hint": "symmetric",
        "association_strength": 0.85,
        "confidence": 0.85,
        "status": "candidate",
        "revision": 1
      }
    },
    {
      "op": "ADD_ASSOCIATION",
      "association": {
        "concept_a": "c_0237",
        "concept_b": "c_0765",
        "relation_type": "categoria",
        "direction_hint": "symmetric",
        "association_strength": 0.75,
        "confidence": 0.85,
        "status": "candidate",
        "revision": 1
      }
    },
    {
      "op": "ADD_ASSOCIATION",
      "association": {
        "concept_a": "c_0235",
        "concept_b": "c_0765",
        "relation_type": "categoria",
        "direction_hint": "symmetric",
        "association_strength": 0.7,
        "confidence": 0.85,
        "status": "candidate",
        "revision": 1
      }
    },
    {
      "op": "ADD_ASSOCIATION",
      "association": {
        "concept_a": "c_0765",
        "concept_b": "c_0767",
        "relation_type": "categoria",
        "direction_hint": "symmetric",
        "association_strength": 0.65,
        "confidence": 0.85,
        "status": "candidate",
        "revision": 1
      }
    },
    {
      "op": "ADD_ASSOCIATION",
      "association": {
        "concept_a": "c_0240",
        "concept_b": "c_0765",
        "relation_type": "similarità",
        "direction_hint": "symmetric",
        "association_strength": 0.6,
        "confidence": 0.85,
        "status": "candidate",
        "revision": 1
      }
    },
    {
      "op": "ADD_ASSOCIATION",
      "association": {
        "concept_a": "c_0765",
        "concept_b": "c_0771",
        "relation_type": "similarità",
        "direction_hint": "symmetric",
        "association_strength": 0.5,
        "confidence": 0.85,
        "status": "candidate",
        "revision": 1
      }
    },
    {
      "op": "ADD_ASSOCIATION",
      "association": {
        "concept_a": "c_0204",
        "concept_b": "c_0765",
        "relation_type": "contrasto",
        "direction_hint": "symmetric",
        "association_strength": 0.5,
        "confidence": 0.85,
        "status": "candidate",
        "revision": 1
      }
    },
    {
      "op": "ADD_ASSOCIATION",
      "association": {
        "concept_a": "c_0750",
        "concept_b": "c_0765",
        "relation_type": "contrasto",
        "direction_hint": "symmetric",
        "association_strength": 0.5,
        "confidence": 0.85,
        "status": "candidate",
        "revision": 1
      }
    },
    {
      "op": "ADD_ASSOCIATION",
      "association": {
        "concept_a": "c_0765",
        "concept_b": "c_0773",
        "relation_type": "proprietà",
        "direction_hint": "symmetric",
        "association_strength": 0.45,
        "confidence": 0.85,
        "status": "candidate",
        "revision": 1
      }
    },
    {
      "op": "ADD_ASSOCIATION",
      "association": {
        "concept_a": "c_0016",
        "concept_b": "c_0765",
        "relation_type": "esseri_viventi",
        "direction_hint": "symmetric",
        "association_strength": 0.55,
        "confidence": 0.85,
        "status": "candidate",
        "revision": 1
      }
    },
    {
      "op": "ADD_ASSOCIATION",
      "association": {
        "concept_a": "c_0238",
        "concept_b": "c_0765",
        "relation_type": "esseri_viventi",
        "direction_hint": "symmetric",
        "association_strength": 0.55,
        "confidence": 0.85,
        "status": "candidate",
        "revision": 1
      }
    },
    {
      "op": "ADD_ASSOCIATION",
      "association": {
        "concept_a": "c_0239",
        "concept_b": "c_0765",
        "relation_type": "esseri_viventi",
        "direction_hint": "symmetric",
        "association_strength": 0.5,
        "confidence": 0.85,
        "status": "candidate",
        "revision": 1
      }
    },
    {
      "op": "ADD_ASSOCIATION",
      "association": {
        "concept_a": "c_0197",
        "concept_b": "c_0765",
        "relation_type": "luoghi",
        "direction_hint": "symmetric",
        "association_strength": 0.5,
        "confidence": 0.85,
        "status": "candidate",
        "revision": 1
      }
    },
    {
      "op": "ADD_ASSOCIATION",
      "association": {
        "concept_a": "c_0013",
        "concept_b": "c_0765",
        "relation_type": "luoghi",
        "direction_hint": "symmetric",
        "association_strength": 0.45,
        "confidence": 0.85,
        "status": "candidate",
        "revision": 1
      }
    },
    {
      "op": "ADD_ASSOCIATION",
      "association": {
        "concept_a": "c_0743",
        "concept_b": "c_0765",
        "relation_type": "evocativa",
        "direction_hint": "symmetric",
        "association_strength": 0.6,
        "confidence": 0.85,
        "status": "candidate",
        "revision": 1
      }
    },
    {
      "op": "ADD_ASSOCIATION",
      "association": {
        "concept_a": "c_0203",
        "concept_b": "c_0765",
        "relation_type": "evocativa",
        "direction_hint": "symmetric",
        "association_strength": 0.55,
        "confidence": 0.85,
        "status": "candidate",
        "revision": 1
      }
    },
    {
      "op": "ADD_ASSOCIATION",
      "association": {
        "concept_a": "c_0198",
        "concept_b": "c_0765",
        "relation_type": "evocativa",
        "direction_hint": "symmetric",
        "association_strength": 0.55,
        "confidence": 0.85,
        "status": "candidate",
        "revision": 1
      }
    },
    {
      "op": "ADD_ASSOCIATION",
      "association": {
        "concept_a": "c_0350",
        "concept_b": "c_0765",
        "relation_type": "evocativa",
        "direction_hint": "symmetric",
        "association_strength": 0.4,
        "confidence": 0.85,
        "status": "candidate",
        "revision": 1
      }
    }
  ]
}
